ID_Transaction,ID_CLIENT_SYNTH,ID_Beneficiaire,Nom_Beneficiaire,Montant_Chiffres,Montant_Lettres,Lieu_Emission,Date_Emission,Numero_Cheque_Emetteur,Agence_Adresse,Agence_Telephone,Nom_Emetteur,Code_Banque,Code_Agent,Numero_Compte,Cle_RIB,Signature_Path_Genuine,is_Fraude_Solde,is_Fraude_Montant
422,244,135,Ezzahiria Lakhdar,4592.06,quatre mille cinq cent quatre-vingt-douze et zéro six dirhams,Rabat,02-05-2025,1000422,"Rue Abd. El Ghafiqui, Agdal, Rabat",0537 68 56 90,Nabil Moumni,007,767,1300000053086381,73,backend/app/data/sign_data\269,False,False
423,244,813,Widen-May Salim,6596.86,six mille cinq cent quatre-vingt-seize et huit six dirhams,Rabat,16-11-2025,1000423,"Rue Abd. El Ghafiqui, Agdal, Rabat",0537 68 56 90,Nabil Moumni,007,767,1300000053086381,73,backend/app/data/sign_data\269,False,False
424,245,437,Ilyas Charaf,8323.46,huit mille trois cent vingt-trois et quatre six dirhams,Fès,18-09-2025,1000424,"LOT 3, Rte Immouzer, Fes-Saiss",0535 64 41 22,Fatima Zohra Chakir,007,515,5600000054320948,07,backend/app/data/sign_data\270,False,False
425,246,776,Hajar Hilal,4998.51,quatre mille neuf cent quatre-vingt-dix-huit et cinq un dirhams,Tanger,04-08-2025,1000425,"49 Av. Anfa, Souani, Tanger",0539 93 11 25,Rahma El mehdi,007,719,9500000055555515,61,backend/app/data/sign_data\271,False,False
426,246,120,Abdelaalim Zitouni,1799.84,mille sept cent quatre-vingt-dix-neuf et huit quatre dirhams,Casablanca,17-09-2025,1000426,"128, Avenue 2 mars, Casablanca",0522 85 92 80,Rahma El mehdi,007,719,9500000055555515,61,backend/app/data/sign_data\271,False,False
427,247,565,Abdelmouttalib Mustapha,92565.27,quatre-vingt-douze mille cinq cent soixante-cinq et deux sept dirhams,Tanger,21-02-2025,1000427,"49 Av. Anfa, Souani, Tanger",0539 93 11 25,Abdelhamid Khalid,007,898,8400000056790082,61,backend/app/data/sign_data\272,True,False
428,248,828,Adiba Abdel,4768.51,quatre mille sept cent soixante-huit et cinq un dirhams,Tanger,26-01-2025,1000428,"49 Av. Anfa, Souani, Tanger",0539 93 11 25,Malika Yassine,007,820,8400000058024649,60,backend/app/data/sign_data\273,False,False
429,248,682,Aizza Er,3159.8,trois mille cent cinquante-neuf et huit dirhams,Fès,25-12-2024,1000429,"LOT 3, Rte Immouzer, Fes-Saiss",0535 64 41 22,Malika Yassine,007,820,8400000058024649,60,backend/app/data/sign_data\273,False,False
430,249,259,Ghanim Mahboub,5662.73,cinq mille six cent soixante-deux et sept trois dirhams,Tanger,05-11-2025,1000430,"49 Av. Anfa, Souani, Tanger",0539 93 11 25,Abdessadek Anas,007,741,7200000059259216,45,backend/app/data/sign_data\274,False,False
431,250,286,Saad Maarouf,2604.74,deux mille six cent quatre et sept quatre dirhams,Tanger,14-07-2025,1000431,"49 Av. Anfa, Souani, Tanger",0539 93 11 25,Bardis Chadli,007,323,4000000060493783,77,backend/app/data/sign_data\275,False,False
432,251,44,Aziza Drissi,8760.83,huit mille sept cent soixante et huit trois dirhams,Rabat,19-03-2025,1000432,"Rue Abd. El Ghafiqui, Agdal, Rabat",0537 68 56 90,Touiba Kabbaj,007,706,2500000061728350,53,backend/app/data/sign_data\276,False,False
433,251,711,Achouak Nait,3326.68,trois mille trois cent vingt-six et six huit dirhams,Marrakech,21-09-2025,1000433,"187, Av. Mohammed V, Gueliz",0524 43 03 20,Touiba Kabbaj,007,706,2500000061728350,53,backend/app/data/sign_data\276,False,False
434,252,700,Yahya El abbassi,1057.12,mille cinquante-sept et un deux dirhams,Rabat,11-06-2025,1000434,"Rue Abd. El Ghafiqui, Agdal, Rabat",0537 68 56 90,Bachir El kadiri,007,583,8500000062962917,89,backend/app/data/sign_data\277,False,False
435,252,783,Oud Elouard Sabri,4427.67,quatre mille quatre cent vingt-sept et six sept dirhams,Tanger,29-10-2025,1000435,"49 Av. Anfa, Souani, Tanger",0539 93 11 25,Bachir El kadiri,007,583,8500000062962917,89,backend/app/data/sign_data\277,False,False
436,253,177,Abdessafi Youssef,995.57,neuf cent quatre-vingt-quinze et cinq sept dirhams,Fès,23-08-2025,1000436,"LOT 3, Rte Immouzer, Fes-Saiss",0535 64 41 22,Abdelaati El mansouri,007,722,6700000064197484,59,backend/app/data/sign_data\278,False,False
437,254,189,Thami El hassani,9460.09,neuf mille quatre cent soixante et zéro neuf dirhams,Rabat,18-05-2025,1000437,"Rue Abd. El Ghafiqui, Agdal, Rabat",0537 68 56 90,Choukri Naciri,007,387,2900000065432051,66,backend/app/data/sign_data\279,False,False
438,255,208,Seouar Omar,6795.56,six mille sept cent quatre-vingt-quinze et cinq six dirhams,Tanger,09-06-2025,1000438,"49 Av. Anfa, Souani, Tanger",0539 93 11 25,Kassem Elamrani,007,533,3700000066666618,58,backend/app/data/sign_data\280,False,False
439,255,784,Chakib Zouhair,1280.76,mille deux cent quatre-vingts et sept six dirhams,Marrakech,18-08-2025,1000439,"187, Av. Mohammed V, Gueliz",0524 43 03 20,Kassem Elamrani,007,533,3700000066666618,58,backend/app/data/sign_data\280,False,False
440,256,39,Elarabi Karim,8497.5,huit mille quatre cent quatre-vingt-dix-sept et cinq dirhams,Fès,25-10-2025,1000440,"LOT 3, Rte Immouzer, Fes-Saiss",0535 64 41 22,Bouchtaouia Ameziane,007,357,8100000067901185,20,backend/app/data/sign_data\281,False,False
441,256,463,Abdelmoghit Kaddouri,1477.13,Mille dirhams,Casablanca,05-06-2025,1000441,"128, Avenue 2 mars, Casablanca",0522 85 92 80,Bouchtaouia Ameziane,007,357,8100000067901185,20,backend/app/data/sign_data\281,False,True
442,257,629,Aref Lakhal,6032.23,six mille trente-deux et deux trois dirhams,Fès,23-10-2025,1000442,"LOT 3, Rte Immouzer, Fes-Saiss",0535 64 41 22,Nour Eddine Mourad,007,294,0400000069135752,56,backend/app/data/sign_data\282,False,False
443,257,571,Bourhime Zitouni,3699.1,trois mille six cent quatre-vingt-dix-neuf et un dirhams,Rabat,04-04-2025,1000443,"Rue Abd. El Ghafiqui, Agdal, Rabat",0537 68 56 90,Nour Eddine Mourad,007,294,0400000069135752,56,backend/app/data/sign_data\282,False,False
444,258,234,Inaam Amghar,67895.87,soixante-sept mille huit cent quatre-vingt-quinze et huit sept dirhams,Marrakech,03-02-2025,1000444,"187, Av. Mohammed V, Gueliz",0524 43 03 20,Abdelmouhaimin Jabrane,007,276,3800000070370319,35,backend/app/data/sign_data\283,True,False
445,259,691,Khair Eddine Kharbouch,4682.18,quatre mille six cent quatre-vingt-deux et un huit dirhams,Casablanca,01-10-2025,1000445,"128, Avenue 2 mars, Casablanca",0522 85 92 80,Najah Rachidi,007,474,6900000071604886,15,backend/app/data/sign_data\284,False,False
446,260,537,Hourma Chraibi,6082.43,six mille quatre-vingt-deux et quatre trois dirhams,Marrakech,08-03-2025,1000446,"187, Av. Mohammed V, Gueliz",0524 43 03 20,Mabrouk Hayat,007,322,1500000072839453,58,backend/app/data/sign_data\286,False,False
447,260,482,Rabie Hachimi,3815.66,trois mille huit cent quinze et six six dirhams,Fès,08-12-2024,1000447,"LOT 3, Rte Immouzer, Fes-Saiss",0535 64 41 22,Mabrouk Hayat,007,322,1500000072839453,58,backend/app/data/sign_data\286,False,False
448,261,255,Ilhame Jamal,16228.61,seize mille deux cent vingt-huit et six un dirhams,Fès,18-08-2025,1000448,"LOT 3, Rte Immouzer, Fes-Saiss",0535 64 41 22,Rahmoun Elidrissi,007,710,1100000074074020,16,backend/app/data/sign_data\287,True,False
449,261,599,Adham Mekouar,16228.61,seize mille deux cent vingt-huit et six un dirhams,Agadir,17-03-2025,1000449,"Bd Mohammed V, Cplxe Fdn Hassan II",0528 84 17 97,Rahmoun Elidrissi,007,710,1100000074074020,16,backend/app/data/sign_data\287,True,False
450,261,830,Adham Taha,16228.61,seize mille deux cent vingt-huit et six un dirhams,Fès,12-06-2025,1000450,"LOT 3, Rte Immouzer, Fes-Saiss",0535 64 41 22,Rahmoun Elidrissi,007,710,1100000074074020,16,backend/app/data/sign_data\287,True,False
451,262,720,Houari Jabrane,35297.6,trente-cinq mille deux cent quatre-vingt-dix-sept et six dirhams,Casablanca,12-08-2025,1000451,"128, Avenue 2 mars, Casablanca",0522 85 92 80,Masen El idrissi,007,117,4100000075308587,02,backend/app/data/sign_data\288,True,False
452,263,219,Narjis Wahbi,4765.71,quatre mille sept cent soixante-cinq et sept un dirhams,Agadir,11-06-2025,1000452,"Bd Mohammed V, Cplxe Fdn Hassan II",0528 84 17 97,Badda Bouali,007,360,4100000076543154,18,backend/app/data/sign_data\289,False,False
453,263,662,Khachane Fathi,8411.55,huit mille quatre cent onze et cinq cinq dirhams,Rabat,04-12-2024,1000453,"Rue Abd. El Ghafiqui, Agdal, Rabat",0537 68 56 90,Badda Bouali,007,360,4100000076543154,18,backend/app/data/sign_data\289,False,False
454,264,370,Abdenbi Benjelloun,899.87,huit cent quatre-vingt-dix-neuf et huit sept dirhams,Casablanca,01-08-2025,1000454,"128, Avenue 2 mars, Casablanca",0522 85 92 80,Zineb Kaddouri,007,279,4300000077777721,87,backend/app/data/sign_data\290,False,False
455,264,646,Rahima Bennouna,9679.84,neuf mille six cent soixante-dix-neuf et huit quatre dirhams,Rabat,23-12-2024,1000455,"Rue Abd. El Ghafiqui, Agdal, Rabat",0537 68 56 90,Zineb Kaddouri,007,279,4300000077777721,87,backend/app/data/sign_data\290,False,False
456,265,136,Sobhi Tarik,13165.43,Mille dirhams,Fès,10-06-2025,1000456,"LOT 3, Rte Immouzer, Fes-Saiss",0535 64 41 22,Chahed Fadil,007,415,0100000079012288,61,backend/app/data/sign_data\291,True,True
457,266,450,Nour Faiz,5101.3,cinq mille cent un et trois dirhams,Agadir,03-06-2025,1000457,"Bd Mohammed V, Cplxe Fdn Hassan II",0528 84 17 97,Rahiba Drissi,007,116,9000000080246855,27,backend/app/data/sign_data\292,False,False
458,267,809,Zeroual Ibrahimi,9128.12,neuf mille cent vingt-huit et un deux dirhams,Casablanca,27-09-2025,1000458,"128, Avenue 2 mars, Casablanca",0522 85 92 80,Radia Yassine,007,189,3300000081481422,93,backend/app/data/sign_data\293,False,False
459,267,226,Abdelhakim Sabir,762.36,sept cent soixante-deux et trois six dirhams,Tanger,08-02-2025,1000459,"49 Av. Anfa, Souani, Tanger",0539 93 11 25,Radia Yassine,007,189,3300000081481422,93,backend/app/data/sign_data\293,False,False
460,268,490,Khalid Najib,2398.14,deux mille trois cent quatre-vingt-dix-huit et un quatre dirhams,Casablanca,27-08-2025,1000460,"128, Avenue 2 mars, Casablanca",0522 85 92 80,Fatna Moumni,007,841,9200000082715989,63,backend/app/data/sign_data\294,False,False
461,269,917,Yajjou Dahmani,7371.53,sept mille trois cent soixante et onze et cinq trois dirhams,Tanger,08-05-2025,1000461,"49 Av. Anfa, Souani, Tanger",0539 93 11 25,Laith Alaoui,007,782,0700000083950556,43,backend/app/data/sign_data\295,False,False
462,269,464,Abderrazak Nassiri,2348.48,deux mille trois cent quarante-huit et quatre huit dirhams,Tanger,12-09-2025,1000462,"49 Av. Anfa, Souani, Tanger",0539 93 11 25,Laith Alaoui,007,782,0700000083950556,43,backend/app/data/sign_data\295,False,False
463,269,586,Kamila Anouar,5079.05,cinq mille soixante-dix-neuf et zéro cinq dirhams,Agadir,29-01-2025,1000463,"Bd Mohammed V, Cplxe Fdn Hassan II",0528 84 17 97,Laith Alaoui,007,782,0700000083950556,43,backend/app/data/sign_data\295,False,False
464,270,330,Sohaib Haddad,5599.84,Mille dirhams,Fès,17-10-2025,1000464,"LOT 3, Rte Immouzer, Fes-Saiss",0535 64 41 22,Belkas Boukhari,007,221,3200000085185123,45,backend/app/data/sign_data\296,False,True
465,270,660,Lakhdar Zitouni,3162.62,trois mille cent soixante-deux et six deux dirhams,Marrakech,19-12-2024,1000465,"187, Av. Mohammed V, Gueliz",0524 43 03 20,Belkas Boukhari,007,221,3200000085185123,45,backend/app/data/sign_data\296,False,False
466,271,117,Asmae Rachidi,9317.02,neuf mille trois cent dix-sept et zéro deux dirhams,Marrakech,03-03-2025,1000466,"187, Av. Mohammed V, Gueliz",0524 43 03 20,Kheira El azzouzi,007,633,9600000086419690,06,backend/app/data/sign_data\297,False,False
467,271,595,Safae Said,1503.12,mille cinq cent trois et un deux dirhams,Agadir,14-07-2025,1000467,"Bd Mohammed V, Cplxe Fdn Hassan II",0528 84 17 97,Kheira El azzouzi,007,633,9600000086419690,06,backend/app/data/sign_data\297,False,False
468,272,704,Ayada Boukhari,255.13,deux cent cinquante-cinq et un trois dirhams,Agadir,28-05-2025,1000468,"Bd Mohammed V, Cplxe Fdn Hassan II",0528 84 17 97,Ahlam El hilali,007,804,0400000087654257,18,backend/app/data/sign_data\298,False,False
469,273,764,Irchad Aarab,8019.18,huit mille dix-neuf et un huit dirhams,Tanger,15-08-2025,1000469,"49 Av. Anfa, Souani, Tanger",0539 93 11 25,Majda Maarouf,007,512,9300000088888824,80,backend/app/data/sign_data\299,False,False
470,274,685,Oumelghit El hassane,7189.92,sept mille cent quatre-vingt-neuf et neuf deux dirhams,Fès,01-12-2024,1000470,"LOT 3, Rte Immouzer, Fes-Saiss",0535 64 41 22,Rhassane Abdel,007,315,6000000090123391,64,backend/app/data/sign_data\300,False,False
471,274,755,Hmad Badri,4598.19,quatre mille cinq cent quatre-vingt-dix-huit et un neuf dirhams,Fès,22-10-2025,1000471,"LOT 3, Rte Immouzer, Fes-Saiss",0535 64 41 22,Rhassane Abdel,007,315,6000000090123391,64,backend/app/data/sign_data\300,False,False
472,275,511,Aizza Sara,3092.69,trois mille quatre-vingt-douze et six neuf dirhams,Agadir,19-05-2025,1000472,"Bd Mohammed V, Cplxe Fdn Hassan II",0528 84 17 97,Elkebir Belghiti,007,288,1200000091357958,05,backend/app/data/sign_data\301,False,False
473,275,521,Nassef Zakaria,5114.65,cinq mille cent quatorze et six cinq dirhams,Casablanca,14-03-2025,1000473,"128, Avenue 2 mars, Casablanca",0522 85 92 80,Elkebir Belghiti,007,288,1200000091357958,05,backend/app/data/sign_data\301,False,False
474,276,609,Fadila Slaoui,6652.2,six mille six cent cinquante-deux et deux dirhams,Tanger,10-09-2025,1000474,"49 Av. Anfa, Souani, Tanger",0539 93 11 25,Marouane Mokhtari,007,842,8500000092592525,03,backend/app/data/sign_data\302,False,False
475,277,737,Baaka Fadel,1815.8,mille huit cent quinze et huit dirhams,Casablanca,26-05-2025,1000475,"128, Avenue 2 mars, Casablanca",0522 85 92 80,Zine Samir,007,711,1500000093827092,72,backend/app/data/sign_data\303,False,False
476,278,620,Choumaissa Maarouf,36333.47,trente-six mille trois cent trente-trois et quatre sept dirhams,Fès,29-12-2024,1000476,"LOT 3, Rte Immouzer, Fes-Saiss",0535 64 41 22,Abdelali Hatim,007,445,5400000095061659,94,backend/app/data/sign_data\304,True,False
477,278,735,Ebdelkahar Youssef,36333.47,trente-six mille trois cent trente-trois et quatre sept dirhams,Rabat,28-03-2025,1000477,"Rue Abd. El Ghafiqui, Agdal, Rabat",0537 68 56 90,Abdelali Hatim,007,445,5400000095061659,94,backend/app/data/sign_data\304,True,False
478,279,677,Kadhem Talbi,96557.65,quatre-vingt-seize mille cinq cent cinquante-sept et six cinq dirhams,Casablanca,13-09-2025,1000478,"128, Avenue 2 mars, Casablanca",0522 85 92 80,Jalal Salim,007,704,8300000096296226,03,backend/app/data/sign_data\305,True,False
479,280,702,Anouar Hasnaoui,3800.65,trois mille huit cents et six cinq dirhams,Marrakech,27-01-2025,1000479,"187, Av. Mohammed V, Gueliz",0524 43 03 20,Jouda Hafid,007,841,4300000097530793,30,backend/app/data/sign_data\306,False,False
480,281,645,Afnane Haddad,5544.76,cinq mille cinq cent quarante-quatre et sept six dirhams,Tanger,20-01-2025,1000480,"49 Av. Anfa, Souani, Tanger",0539 93 11 25,Hadil Fadil,007,973,7000000098765360,64,backend/app/data/sign_data\307,False,False
481,282,988,Charifa Abdellaoui,8966.87,huit mille neuf cent soixante-six et huit sept dirhams,Agadir,16-03-2025,1000481,"Bd Mohammed V, Cplxe Fdn Hassan II",0528 84 17 97,Abdelhadi Madani,007,926,5300000099999927,35,backend/app/data/sign_data\308,False,False
482,283,57,Kaouakib Najib,137390.68,Mille dirhams,Marrakech,24-03-2025,1000482,"187, Av. Mohammed V, Gueliz",0524 43 03 20,Kawakib Loukili,007,860,9300000101234494,58,backend/app/data/sign_data\309,True,True
483,284,621,Rabie Zitouni,599.38,cinq cent quatre-vingt-dix-neuf et trois huit dirhams,Rabat,17-08-2025,1000483,"Rue Abd. El Ghafiqui, Agdal, Rabat",0537 68 56 90,Kabira Slaoui,007,164,4300000102469061,42,backend/app/data/sign_data\310,False,False
484,284,243,Tamime Omar,8853.89,Mille dirhams,Fès,12-12-2024,1000484,"LOT 3, Rte Immouzer, Fes-Saiss",0535 64 41 22,Kabira Slaoui,007,164,4300000102469061,42,backend/app/data/sign_data\310,False,True
485,285,954,Farji El mokhtar,4345.65,quatre mille trois cent quarante-cinq et six cinq dirhams,Tanger,16-06-2025,1000485,"49 Av. Anfa, Souani, Tanger",0539 93 11 25,Abdelmoughit Taleb,007,461,3500000103703628,46,backend/app/data/sign_data\311,False,False
486,285,12,Fahd Benjelloun,3838.56,trois mille huit cent trente-huit et cinq six dirhams,Rabat,29-03-2025,1000486,"Rue Abd. El Ghafiqui, Agdal, Rabat",0537 68 56 90,Abdelmoughit Taleb,007,461,3500000103703628,46,backend/app/data/sign_data\311,False,False
487,286,143,Dahbia Hafid,6778.82,six mille sept cent soixante-dix-huit et huit deux dirhams,Agadir,10-03-2025,1000487,"Bd Mohammed V, Cplxe Fdn Hassan II",0528 84 17 97,Oualim Lachhab,007,117,1700000104938195,45,backend/app/data/sign_data\312,False,False
488,286,285,Allouch Fassi,6090.8,six mille quatre-vingt-dix et huit dirhams,Agadir,27-08-2025,1000488,"Bd Mohammed V, Cplxe Fdn Hassan II",0528 84 17 97,Oualim Lachhab,007,117,1700000104938195,45,backend/app/data/sign_data\312,False,False
489,287,692,Ilias Es,4792.24,quatre mille sept cent quatre-vingt-douze et deux quatre dirhams,Tanger,02-09-2025,1000489,"49 Av. Anfa, Souani, Tanger",0539 93 11 25,Eddaoui Salim,007,650,5300000106172762,27,backend/app/data/sign_data\313,False,False
490,288,500,Mallal Salma,5915.74,cinq mille neuf cent quinze et sept quatre dirhams,Agadir,21-08-2025,1000490,"Bd Mohammed V, Cplxe Fdn Hassan II",0528 84 17 97,Ghita Hassani,007,179,4400000107407329,23,backend/app/data/sign_data\314,False,False
491,289,885,Diae Mustapha,97572.63,quatre-vingt-dix-sept mille cinq cent soixante-douze et six trois dirhams,Rabat,27-04-2025,1000491,"Rue Abd. El Ghafiqui, Agdal, Rabat",0537 68 56 90,Nadir Bennis,007,104,3000000108641896,09,backend/app/data/sign_data\315,True,False
492,290,900,Charki Taibi,1149.31,mille cent quarante-neuf et trois un dirhams,Fès,27-02-2025,1000492,"LOT 3, Rte Immouzer, Fes-Saiss",0535 64 41 22,Mahboub Salhi,007,439,5600000109876463,09,backend/app/data/sign_data\316,False,False
493,290,524,Ikhlas Boutaleb,5213.33,cinq mille deux cent treize et trois trois dirhams,Agadir,01-02-2025,1000493,"Bd Mohammed V, Cplxe Fdn Hassan II",0528 84 17 97,Mahboub Salhi,007,439,5600000109876463,09,backend/app/data/sign_data\316,False,False
494,291,393,Abdessamad Ahmed,8673.49,huit mille six cent soixante-treize et quatre neuf dirhams,Tanger,15-02-2025,1000494,"49 Av. Anfa, Souani, Tanger",0539 93 11 25,Firdaous Talbi,007,902,7200000111111030,34,backend/app/data/sign_data\317,False,False
495,291,398,Aouiss Boutaleb,105.54,cent cinq et cinq quatre dirhams,Tanger,20-05-2025,1000495,"49 Av. Anfa, Souani, Tanger",0539 93 11 25,Firdaous Talbi,007,902,7200000111111030,34,backend/app/data/sign_data\317,False,False
496,292,404,Abdelaati Benamar,3026.23,trois mille vingt-six et deux trois dirhams,Agadir,26-09-2025,1000496,"Bd Mohammed V, Cplxe Fdn Hassan II",0528 84 17 97,Arifa Achraf,007,198,1800000112345597,42,backend/app/data/sign_data\318,False,False
497,293,319,Hababa Hakim,1357.05,Mille dirhams,Fès,07-01-2025,1000497,"LOT 3, Rte Immouzer, Fes-Saiss",0535 64 41 22,Taoufika Morchid,007,105,8300000113580164,56,backend/app/data/sign_data\319,False,True
498,294,851,Fadoua Tijani,3984.25,trois mille neuf cent quatre-vingt-quatre et deux cinq dirhams,Tanger,15-06-2025,1000498,"49 Av. Anfa, Souani, Tanger",0539 93 11 25,Souhaib El alami,007,221,5900000114814731,91,backend/app/data/sign_data\320,False,False
499,295,650,Taher Touil,9470.31,neuf mille quatre cent soixante-dix et trois un dirhams,Tanger,16-02-2025,1000499,"49 Av. Anfa, Souani, Tanger",0539 93 11 25,Imran Kadiri,007,539,1400000116049298,34,backend/app/data/sign_data\321,False,False
500,296,422,Sabri Fouad,10444.7,dix mille quatre cent quarante-quatre et sept dirhams,Rabat,03-10-2025,1000500,"Rue Abd. El Ghafiqui, Agdal, Rabat",0537 68 56 90,Daidai Alaoui,007,672,8300000117283865,25,backend/app/data/sign_data\322,True,False
501,296,957,Bachira Ameziane,10444.7,dix mille quatre cent quarante-quatre et sept dirhams,Fès,23-08-2025,1000501,"LOT 3, Rte Immouzer, Fes-Saiss",0535 64 41 22,Daidai Alaoui,007,672,8300000117283865,25,backend/app/data/sign_data\322,True,False
502,297,536,Hoummane Sadiki,49397.06,quarante-neuf mille trois cent quatre-vingt-dix-sept et zéro six dirhams,Rabat,17-12-2024,1000502,"Rue Abd. El Ghafiqui, Agdal, Rabat",0537 68 56 90,Amer El omari,007,974,1000000118518432,19,backend/app/data/sign_data\323,True,False
503,298,866,Widen-May Dahmani,8653.49,huit mille six cent cinquante-trois et quatre neuf dirhams,Casablanca,27-02-2025,1000503,"128, Avenue 2 mars, Casablanca",0522 85 92 80,Mouada El hassan,007,870,2600000119752999,98,backend/app/data/sign_data\324,False,False
504,298,337,Tafout Abdellah,1058.92,mille cinquante-huit et neuf deux dirhams,Fès,24-05-2025,1000504,"LOT 3, Rte Immouzer, Fes-Saiss",0535 64 41 22,Mouada El hassan,007,870,2600000119752999,98,backend/app/data/sign_data\324,False,False
505,299,942,Kacem Meftah,7685.68,sept mille six cent quatre-vingt-cinq et six huit dirhams,Tanger,11-11-2025,1000505,"49 Av. Anfa, Souani, Tanger",0539 93 11 25,Loubna Abdou,007,171,6900000120987566,80,backend/app/data/sign_data\327,False,False
506,300,123,Loujain El mehdi,8496.55,huit mille quatre cent quatre-vingt-seize et cinq cinq dirhams,Marrakech,24-07-2025,1000506,"187, Av. Mohammed V, Gueliz",0524 43 03 20,Eddaoui Ayoub,007,935,9000000122222133,72,backend/app/data/sign_data\328,False,False
507,301,623,Bouziane Laaroussi,2571.9,deux mille cinq cent soixante et onze et neuf dirhams,Tanger,03-12-2024,1000507,"49 Av. Anfa, Souani, Tanger",0539 93 11 25,Maounia Elalaoui,007,112,2300000123456700,99,backend/app/data/sign_data\329,False,False
508,302,794,Laite Saoudi,5660.12,cinq mille six cent soixante et un deux dirhams,Tanger,05-01-2025,1000508,"49 Av. Anfa, Souani, Tanger",0539 93 11 25,Khair Eddine Toumi,007,385,4300000124691267,89,backend/app/data/sign_data\330,False,False
509,303,429,Ghazi El bakkali,1726.3,mille sept cent vingt-six et trois dirhams,Marrakech,15-08-2025,1000509,"187, Av. Mohammed V, Gueliz",0524 43 03 20,Widad Adnane,007,863,4700000125925834,89,backend/app/data/sign_data\331,False,False
510,304,315,Ishaq El hassani,3272.24,trois mille deux cent soixante-douze et deux quatre dirhams,Casablanca,11-04-2025,1000510,"128, Avenue 2 mars, Casablanca",0522 85 92 80,Fettah Hamdani,007,983,9200000127160401,12,backend/app/data/sign_data\332,False,False
511,305,66,Hamoud Kabbaj,1040.92,mille quarante et neuf deux dirhams,Casablanca,14-10-2025,1000511,"128, Avenue 2 mars, Casablanca",0522 85 92 80,Hourma Semlali,007,251,1300000128394968,48,backend/app/data/sign_data\333,False,False
512,305,859,Mariem Belghiti,3597.73,trois mille cinq cent quatre-vingt-dix-sept et sept trois dirhams,Casablanca,26-10-2025,1000512,"128, Avenue 2 mars, Casablanca",0522 85 92 80,Hourma Semlali,007,251,1300000128394968,48,backend/app/data/sign_data\333,False,False
513,306,950,Sonia Majid,8417.36,huit mille quatre cent dix-sept et trois six dirhams,Agadir,11-05-2025,1000513,"Bd Mohammed V, Cplxe Fdn Hassan II",0528 84 17 97,Fadel Mourad,007,806,0700000129629535,31,backend/app/data/sign_data\334,False,False
514,307,104,Bahssin Elasri,823.39,huit cent vingt-trois et trois neuf dirhams,Casablanca,20-09-2025,1000514,"128, Avenue 2 mars, Casablanca",0522 85 92 80,Arbi Mustapha,007,275,2700000130864102,89,backend/app/data/sign_data\335,False,False
515,307,103,Jaafar Younes,9594.56,Mille dirhams,Rabat,21-05-2025,1000515,"Rue Abd. El Ghafiqui, Agdal, Rabat",0537 68 56 90,Arbi Mustapha,007,275,2700000130864102,89,backend/app/data/sign_data\335,False,True
516,308,95,Yezza Belghiti,6500.71,six mille cinq cents et sept un dirhams,Fès,06-02-2025,1000516,"LOT 3, Rte Immouzer, Fes-Saiss",0535 64 41 22,Yassira Khadija,007,934,8200000132098669,36,backend/app/data/sign_data\336,False,False
517,308,503,Souhaila Lazrak,5264.09,cinq mille deux cent soixante-quatre et zéro neuf dirhams,Casablanca,20-07-2025,1000517,"128, Avenue 2 mars, Casablanca",0522 85 92 80,Yassira Khadija,007,934,8200000132098669,36,backend/app/data/sign_data\336,False,False
518,309,733,Mama Idrissi,9084.75,neuf mille quatre-vingt-quatre et sept cinq dirhams,Casablanca,05-03-2025,1000518,"128, Avenue 2 mars, Casablanca",0522 85 92 80,Hannou Farid,007,770,7400000133333236,36,backend/app/data/sign_data\337,False,False
519,310,513,Alou Chaouki,5441.36,cinq mille quatre cent quarante et un et trois six dirhams,Fès,23-03-2025,1000519,"LOT 3, Rte Immouzer, Fes-Saiss",0535 64 41 22,Jabrane Sebti,007,822,7000000134567803,94,backend/app/data/sign_data\338,False,False
520,310,958,Hamiddouche Moussaoui,3858.88,trois mille huit cent cinquante-huit et huit huit dirhams,Casablanca,29-12-2024,1000520,"128, Avenue 2 mars, Casablanca",0522 85 92 80,Jabrane Sebti,007,822,7000000134567803,94,backend/app/data/sign_data\338,False,False
521,310,686,Amrane Fakir,8545.56,huit mille cinq cent quarante-cinq et cinq six dirhams,Rabat,03-04-2025,1000521,"Rue Abd. El Ghafiqui, Agdal, Rabat",0537 68 56 90,Jabrane Sebti,007,822,7000000134567803,94,backend/app/data/sign_data\338,False,False
522,311,800,Abdeladim Khalid,9253.21,neuf mille deux cent cinquante-trois et deux un dirhams,Agadir,21-08-2025,1000522,"Bd Mohammed V, Cplxe Fdn Hassan II",0528 84 17 97,Khaddouj Ismail,007,816,3600000135802370,14,backend/app/data/sign_data\339,False,False
523,312,280,Lobaba Chakir,6635.66,six mille six cent trente-cinq et six six dirhams,Rabat,02-11-2025,1000523,"Rue Abd. El Ghafiqui, Agdal, Rabat",0537 68 56 90,Yakout El idrissi,007,442,6900000137036937,13,backend/app/data/sign_data\340,False,False
524,313,687,Taj Eddine Chaoui,5770.64,cinq mille sept cent soixante-dix et six quatre dirhams,Agadir,08-04-2025,1000524,"Bd Mohammed V, Cplxe Fdn Hassan II",0528 84 17 97,Daoud El bakkali,007,679,6300000138271504,11,backend/app/data/sign_data\341,False,False
525,314,172,Abdennasser Sbai,4016.01,quatre mille seize et zéro un dirhams,Marrakech,30-09-2025,1000525,"187, Av. Mohammed V, Gueliz",0524 43 03 20,Loujain Bouayad,007,460,0200000139506071,63,backend/app/data/sign_data\342,False,False
